{
 "schema": "aihw/registry@0.1",
 "standard": "0.3",
 "kit": "0.3",
 "repo": {
  "url": "https://github.com/smile-xuc/aihw-starter",
  "branch": "master",
  "blob_base": "https://github.com/smile-xuc/aihw-starter/blob/master/",
  "tree_base": "https://github.com/smile-xuc/aihw-starter/tree/master/"
 },
 "currency": "CNY",
 "vocab": {
  "archetypes": [
   {
    "id": "realtime-voice",
    "label": "实时语音",
    "description": "按键说话或持续收音，云端实时回语音；时间线突出收音、回答和回复音频"
   },
   {
    "id": "vision",
    "label": "拍照 / 视觉理解",
    "description": "图片（可带语音提问）→ 看图回答或事件卡；时间线旁放样本图片"
   },
   {
    "id": "recorder",
    "label": "录音纪要",
    "description": "录音 → 转写与说话人分离 → 结构化纪要；渲染产出的 Markdown"
   },
   {
    "id": "tools",
    "label": "工具编排 / 结构化输出",
    "description": "指令或数据 → 模型调用工具或按 Schema 输出 → 设备执行；把每轮工具调用做成步骤"
   }
  ],
  "modes": [
   {
    "id": "replay",
    "label": "回放",
    "description": "播放仓库里的 mock 回放轨迹，不调用模型、不需要 Key"
   },
   {
    "id": "local-run",
    "label": "本机真跑",
    "description": "在自己的电脑上用自己的 Key 运行 python3 run.py"
   },
   {
    "id": "browser-run",
    "label": "网页直连真跑",
    "description": "在 APP 或网页里填自己的 Key，直连平台；只有用到的接入点都能从浏览器直连的玩法才行"
   }
  ],
  "parts": [
   {
    "id": "mic",
    "label": "麦克风"
   },
   {
    "id": "speaker",
    "label": "扬声器"
   },
   {
    "id": "camera",
    "label": "摄像头"
   },
   {
    "id": "button",
    "label": "按键"
   },
   {
    "id": "screen",
    "label": "屏幕"
   },
   {
    "id": "led",
    "label": "灯光"
   },
   {
    "id": "motor",
    "label": "电机 / 舵机"
   },
   {
    "id": "vibration",
    "label": "振动马达"
   },
   {
    "id": "health-sensor",
    "label": "健康传感器"
   },
   {
    "id": "arm",
    "label": "机械臂"
   },
   {
    "id": "gripper",
    "label": "夹爪"
   },
   {
    "id": "iot",
    "label": "家居联动"
   }
  ],
  "features": [
   {
    "id": "voice-input",
    "label": "语音输入"
   },
   {
    "id": "voice-output",
    "label": "语音输出"
   },
   {
    "id": "vision",
    "label": "看图"
   },
   {
    "id": "tool-calling",
    "label": "工具调用"
   },
   {
    "id": "structured-output",
    "label": "结构化输出"
   },
   {
    "id": "speaker-diarization",
    "label": "说话人分离"
   },
   {
    "id": "translation",
    "label": "同声传译"
   },
   {
    "id": "long-audio",
    "label": "长录音"
   },
   {
    "id": "memory",
    "label": "长期记忆"
   },
   {
    "id": "on-device-rules",
    "label": "端侧规则"
   },
   {
    "id": "offline-fallback",
    "label": "断网降级"
   },
   {
    "id": "safety-gate",
    "label": "安全门"
   }
  ],
  "compliance": [
   {
    "id": "minors",
    "label": "未成年人",
    "obligation": "面向未成年人的陪伴类产品不得提供虚拟亲属、虚拟伴侣等服务，需要未成年人模式和使用时长提醒；不满十四周岁用户的个人信息属于敏感个人信息，要取得监护人同意",
    "readme_must_cover": [
     "系统提示词如何避免扮演家人或恋人",
     "未成年人模式、时长提醒在量产中由哪一层实现",
     "儿童个人信息的告知与监护人同意"
    ],
    "sources": [
     {
      "title": "人工智能拟人化互动服务管理暂行办法（网信办）",
      "url": "https://www.cac.gov.cn/2026-04/10/c_1777558395078289.htm"
     },
     {
      "title": "个人信息保护法第二十八、三十一条",
      "url": null
     }
    ]
   },
   {
    "id": "anthropomorphic",
    "label": "拟人化互动",
    "obligation": "持续性情感陪伴适用《人工智能拟人化互动服务管理暂行办法》（2026-07-15 施行）：提示 AI 身份与使用时长、防止情感依赖、对极端情绪干预、提供交互数据的删除选项",
    "readme_must_cover": [
     "AI 身份提示和使用时长提醒的实现位置",
     "防沉迷、极端情绪的处理方式",
     "交互数据存在哪里、怎么删除"
    ],
    "sources": [
     {
      "title": "人工智能拟人化互动服务管理暂行办法（网信办）",
      "url": "https://www.cac.gov.cn/2026-04/10/c_1777558395078289.htm"
     }
    ]
   },
   {
    "id": "camera-privacy",
    "label": "摄像头隐私",
    "obligation": "摄像头画面属于个人信息：上传云端前告知并取得同意、写明保存期限；拍摄他人要有明显提示、不得偷拍、不识别身份；公共场所安装图像采集设备须设显著提示标识",
    "readme_must_cover": [
     "告知同意方式与保存期限",
     "画面里有他人时的处理（提示、不留存、不识别身份）",
     "是否做人脸识别；需要时如何取得单独同意"
    ],
    "sources": [
     {
      "title": "个人信息保护法",
      "url": null
     },
     {
      "title": "民法典人格权编（肖像权）",
      "url": null
     }
    ]
   },
   {
    "id": "recording-consent",
    "label": "录音告知同意",
    "obligation": "录音、同传会采集在场其他人的讲话：使用前告知讲话人并取得同意；转写、字幕和纪要设定保存期限，含个人信息时按个人信息保护法处理",
    "readme_must_cover": [
     "设备上的录音提示（如指示灯）与告知方式",
     "录音与转写结果存在哪里、保存多久"
    ],
    "sources": [
     {
      "title": "个人信息保护法",
      "url": null
     }
    ]
   },
   {
    "id": "health",
    "label": "健康数据",
    "obligation": "不做医疗诊断，未取得医疗器械注册前不能宣传「诊断」「监测疾病」；健康数据属于敏感个人信息，处理前要取得用户单独同意",
    "readme_must_cover": [
     "免责声明由哪一层固定追加（不依赖模型）",
     "上传哪些数据、不上传哪些原始数据",
     "单独同意与保存期限"
    ],
    "sources": [
     {
      "title": "个人信息保护法第二十八、二十九条",
      "url": null
     }
    ]
   },
   {
    "id": "safety-critical",
    "label": "安全关键",
    "obligation": "驱动实体动作的产品，急停、限速、力矩限制必须在控制器和硬件层实现，软件安全门只是额外一层；量产前按目标市场的机器人安全标准做风险评估",
    "readme_must_cover": [
     "安全门在哪一层、拦截哪些动作",
     "哪些限制必须在控制器或硬件层实现",
     "现场人员如何叫停"
    ],
    "sources": [
     {
      "title": "ISO 10218、ISO/TS 15066（协作机器人，以目标市场认证清单为准）",
      "url": null
     }
    ]
   }
  ],
  "compliance_baseline": {
   "label": "生成式 AI 服务",
   "obligation": "本仓 demo 是开发者参考实现，不是面向公众的服务；面向公众上线前需完成生成式 AI 服务登记 / 备案与内容标识等义务"
  }
 },
 "stacks": [
  {
   "schema": "aihw/stack@0.1",
   "id": "bailian",
   "name": "阿里云百炼",
   "vendor": "阿里云",
   "docs": [
    {
     "title": "地域与接入地址",
     "url": "https://help.aliyun.com/zh/model-studio/regions"
    },
    {
     "title": "获取与配置 API Key",
     "url": "https://help.aliyun.com/zh/model-studio/get-api-key"
    },
    {
     "title": "业务空间管理",
     "url": "https://docs.modelstudio.console.alibabacloud.com/zh/model-studio/use-workspace"
    }
   ],
   "storage": "local-only",
   "fields": [
    {
     "key": "DASHSCOPE_API_KEY",
     "group": "credential",
     "label": "API Key",
     "input": "secret",
     "required": true,
     "default": null,
     "options": null,
     "placeholder": "sk-…",
     "pattern": "^s[kt]-\\S{8,}$",
     "help": "百炼控制台「密钥管理」创建，只在创建时显示一次；Key 与地域绑定，北京的 Key 不能调新加坡",
     "link": {
      "title": "获取与配置 API Key",
      "url": "https://help.aliyun.com/zh/model-studio/get-api-key"
     }
    },
    {
     "key": "DASHSCOPE_API_REGION",
     "group": "endpoint",
     "label": "地域",
     "input": "select",
     "required": false,
     "default": "cn-beijing",
     "options": [
      {
       "value": "cn-beijing",
       "label": "华北2（北京）"
      },
      {
       "value": "ap-southeast-1",
       "label": "新加坡"
      }
     ],
     "placeholder": null,
     "pattern": null,
     "help": "与 API Key、业务空间所属地域一致，否则接口返回 401；免费额度只在北京地域发放",
     "link": {
      "title": "地域与接入地址",
      "url": "https://help.aliyun.com/zh/model-studio/regions"
     }
    },
    {
     "key": "DASHSCOPE_WORKSPACE_ID",
     "group": "endpoint",
     "label": "业务空间 ID",
     "input": "text",
     "required": false,
     "default": null,
     "options": null,
     "placeholder": "llm-…",
     "pattern": "^[A-Za-z0-9-]+$",
     "help": "控制台「业务空间管理」页 API Host 列，形如 llm-xxx；填了之后全部接口走业务空间专属域名。通用域名自 2026-09-30 起不再支持新特性，部分模型（如 qwen3.8-omni-flash-realtime）必须填",
     "link": {
      "title": "业务空间管理",
      "url": "https://docs.modelstudio.console.alibabacloud.com/zh/model-studio/use-workspace"
     }
    }
   ],
   "endpoints": {
    "roots": [
     {
      "when": {
       "DASHSCOPE_WORKSPACE_ID": "*"
      },
      "label": "业务空间专属域名",
      "http": "https://{DASHSCOPE_WORKSPACE_ID}.{DASHSCOPE_API_REGION}.maas.aliyuncs.com",
      "ws": "wss://{DASHSCOPE_WORKSPACE_ID}.{DASHSCOPE_API_REGION}.maas.aliyuncs.com"
     },
     {
      "when": {
       "DASHSCOPE_API_REGION": "cn-beijing"
      },
      "label": "通用域名（北京）",
      "http": "https://dashscope.aliyuncs.com",
      "ws": "wss://dashscope.aliyuncs.com"
     },
     {
      "when": {
       "DASHSCOPE_API_REGION": "ap-southeast-1"
      },
      "label": "通用域名（新加坡）",
      "http": "https://dashscope-intl.aliyuncs.com",
      "ws": "wss://dashscope-intl.aliyuncs.com"
     }
    ],
    "services": [
     {
      "id": "compatible",
      "label": "OpenAI 兼容接口（文本、看图、工具调用）",
      "url": "{http}/compatible-mode/v1",
      "browser": "ok",
      "browser_note": "2026-10-02 跨域预检通过（通用域名与业务空间域名）；带 Key 的实际响应待真 Key 验证"
     },
     {
      "id": "api",
      "label": "DashScope 原生 HTTP（同步 / 异步推理、任务查询、上传凭证、TTS HTTP）",
      "url": "{http}/api/v1",
      "browser": "ok",
      "browser_note": "2026-10-02 通用域名的跨域预检通过，业务空间域名未测；临时存储上传走 OSS 地址，跨域未测"
     },
     {
      "id": "ws-inference",
      "label": "任务制 WebSocket（流式 ASR、流式 TTS）",
      "url": "{ws}/api-ws/v1/inference",
      "browser": "blocked",
      "browser_note": "握手要带 Authorization 请求头，浏览器的 WebSocket 不能自定义请求头"
     },
     {
      "id": "realtime",
      "label": "Realtime WebSocket（实时语音 / 视频、同传）",
      "url": "{ws}/api-ws/v1/realtime?model={model}",
      "browser": "blocked",
      "browser_note": "握手要带 Authorization 请求头；WebRTC 的 SDP 交换官方要求经业务服务端代理"
     }
    ]
   },
   "auth": {
    "type": "bearer",
    "header": "Authorization",
    "value": "Bearer {DASHSCOPE_API_KEY}"
   },
   "security_advice": [
    "新建一个子业务空间，只授权 demo 用到的模型，并设 RPM / TPM 限流",
    "API Key 用自定义权限，只开放要用的模型，可加 IP 白名单",
    "在费用中心设消费预警：百炼不支持按金额给单个 Key 或业务空间设上限",
    "Key 只存在本机；不用了就在控制台删除这把 Key"
   ]
  }
 ],
 "categories": [
  {
   "id": "01-ipc",
   "no": "01",
   "name": "IPC / AI 视觉",
   "emoji": "📷",
   "capabilities": "事件摘要、自然语言检索、自定义事件告警、每日总结、一键成片等",
   "scenes": "家用安防 / 户外门铃 / 商用监控 / 可穿戴拍摄",
   "industry": {
    "shipments": "待核实 / 5,507（中国消费级销量，2025，洛图）",
    "revenue": "~1,000",
    "ai_share": "~3-5%",
    "trend": "↑",
    "source": {
     "text": "洛图科技（新浪，2026-01-29）",
     "url": "https://finance.sina.com.cn/tech/roll/2026-01-29/doc-inhiyrwa0714712.shtml"
    }
   },
   "industry_units": {
    "shipments": "万台/年",
    "revenue": "亿元/年"
   },
   "docs": {
    "readme": "solutions/by-category/01-ipc/README.md",
    "business": "solutions/by-category/01-ipc/01-business.md",
    "solution": "solutions/by-category/01-ipc/02-solution.md",
    "cost": "solutions/by-category/01-ipc/03-cost.md",
    "cases": "solutions/by-category/01-ipc/04-cases.md",
    "faq": "solutions/by-category/01-ipc/05-faq.md"
   },
   "solutions": [